isbn	title	publisher
1931498873	Amazon.com: How Democrats And Progressives Can Win: Solutions From George Lakeoff (9781931498876): George Lakoff: Books	 Chelsea Green; DVD edition (January 30, 2005)
1400068843	The Death of Conservatism: Sam Tanenhaus: 9781400068845: Amazon.com: Books	 Random House (September 1, 2009)
1401322883	Standing Up to the Madness: Ordinary Heroes in Extraordinary Times: Amy Goodman, David Goodman: 9781401322885: Amazon.com: Books	 Hyperion (April 8, 2008)
0976443740	Deadly Dogma: How Neoconservatives Broke the Law to Deceive America: Grant F. Smith: 9780976443742: Amazon.com: Books	 Institute for Research (March 3, 2006)
0307237931	Amazon.com: The Architect: Karl Rove and the Dream of Absolute Power (9780307237934): James Moore, Wayne Slater: Books	 Three Rivers Press (May 22, 2007)
0809325292	Our Culture of Pandering: Paul Simon: Amazon.com: Books	 Southern Illinois University Press; 1st edition (September 25, 2003)
0374530386	Divided by God: America&#39;s Church-State Problem--and What We Should Do About It: Noah Feldman: 9780374530389: Amazon.com: Books	 Farrar, Straus and Giroux; Reprint edition (June 27, 2006)
1568584105	The Man Who Sold the World: Ronald Reagan and the Betrayal of Main Street America: William Kleinknecht: 9781568584102: Amazon.com: Books	 Nation Books; First Printing edition (February 3, 2009)
1846556023	Pity the Billionaire: The Unlikely Resurgence of the American Right: Thomas Frank: 9781846556029: Amazon.com: Books	 Harvill Secker (January 1, 2012)
0700605800	Shaping Modern Liberalism: Herbert Croly and Progressive Thought: Edward A. Stettner: 9780700605804: Amazon.com: Books	 Univ Pr of Kansas (March 1993)
0230620523	Amazon.com: Barack Obama and African American Empowerment: The Rise of Black America&#39;s New Leadership (Critical Black Studies) (9780230620520): Manning Marable, Kristen Clarke: Books	 Palgrave Macmillan; 1 edition (November 10, 2009)
0142800643	The Best Democracy Money Can Buy: Greg Palast: 9780142800645: Amazon.com: Books	 Penguin Audio; Abridged edition (April 26, 2004)
082651703X	The DeMarco Factor: Transforming Public Will into Political Power: Michael Pertschuk: 9780826517036: Amazon.com: Books	 Vanderbilt University Press; 1 edition (June 25, 2010)
1586484125	The Plan: Big Ideas for America: Rahm Emanuel, Bruce Reed: 9781586484125: Amazon.com: Books	 PublicAffairs; First Edition edition (August 15, 2006)
0740754718	Bush-Whacked: Chronicles of Government Stupidity: Leland Gregory: 9780740754715: Amazon.com: Books	 Andrews McMeel Publishing (October 1, 2005)
141656683X	The Predator State: How Conservatives Abandoned the Free Market and Why Liberals Should Too: James Galbraith: Amazon.com: Books	 Free Press; 1st Free Press Hardcover Ed edition (August 5, 2008)
0399160396	Amazon.com: It&#39;s the Middle Class, Stupid! (9780399160394): James Carville, Stan Greenberg: Books	 Blue Rider Press; 1 edition (July 10, 2012)
0452284163	Skipping Towards Gomorrah: Dan Savage: Amazon.com: Books	 Plume (September 30, 2003)
0812243609	Human Rights in Our Own Backyard: Injustice and Resistance in the United States (Pennsylvania Studies in Human Rights): William T. Armaline, Davita Silfen Glasberg, Bandana Purkayastha: 9780812243604: Amazon.com: Books	 University of Pennsylvania Press (September 27, 2011)
1402757891	The Strange Death of Republican America: Chronicles of a Collapsing Party: Sidney Blumenthal: 9781402757891: Amazon.com: Books	 Union Square Press; 1st edition (April 1, 2008)
1582438013	Delirium: How the Sexual Counterrevolution is Polarizing America: Nancy L. Cohen: 9781582438016: Amazon.com: Books	 Counterpoint (February 7, 2012)
1451694938	Boss Rove: Inside Karl Rove&#39;s Secret Kingdom of Power: Craig Unger: 9781451694932: Amazon.com: Books	 Scribner (September 4, 2012)
0822350173	Amazon.com: Beyond Biopolitics: Essays on the Governance of Life and Death (9780822350170): Patricia Ticineto Clough, Craig Willse: Books	 Duke University Press Books (October 27, 2011)
0670033650	Homegrown Democrat: A Few Plain Thoughts from the Heart of America: Garrison Keillor: 9780670033652: Amazon.com: Books	 Viking Adult (July 15, 2004)
0767928350	A Time to Fight: Reclaiming a Fair and Just America: Jim Webb: 9780767928359: Amazon.com: Books	 Broadway; 1 edition (May 19, 2008)
0199764026	Crisis of Conservatism?: The Republican Party, the Conservative Movement, and American Politics After Bush: Joel D. Aberbach, Gillian Peele: 9780199764020: Amazon.com: Books	 Oxford University Press, USA; 1 edition (June 17, 2011)
081664361X	Urban Nightmares: The Media, The Right, And The Moral Panic Over The City: Steve Macek: 9780816643615: Amazon.com: Books	 Univ Of Minnesota Press; 1 edition (May 25, 2006)
1565846346	Amazon.com: Rich Media, Poor Democracy: Communication Politics in Dubious Times (9781565846340): Robert W. McChesney: Books	 New Press, The (October 2000)
1568586434	Days of Destruction, Days of Revolt: Chris Hedges, Joe Sacco: 9781568586434: Amazon.com: Books	 Nation Books; First Edition edition (June 12, 2012)
0029187508	The Establishment Clause: Religion and the First Amendment: Leonard W. Levy: 9780029187500: Amazon.com: Books	 Macmillan Pub Co (September 1986)
0815721986	Campaign 2012: Twelve Independent Ideas for Improving American Public Policy: Benjamin Wittes: 9780815721987: Amazon.com: Books	 Brookings Institution Press; 1 edition (May 18, 2012)
0975574604	Bush Lies In State: Malachy McCourt: 9780975574607: Amazon.com: Books	 Sensei Publications; First Edition edition (July 1, 2004)
1603582932	Amazon.com: The Progressive&#39;s Guide to Raising Hell: How to Win Grassroots Campaigns, Pass Ballot Box Laws, and Get the Change We Voted For-- A Direct Democracy Toolkit (9781603582933): Jamie Court: Books	 Chelsea Green Publishing; 1 edition (August 27, 2010)
0807079553	The Twilight of Equality?: Neoliberalism, Cultural Politics, and the Attack on Democracy: Lisa Duggan: 0046442079556: Amazon.com: Books	 Beacon Press (October 11, 2004)
0521028337	Fulbright: A Biography: Randall Bennett Woods: 9780521028332: Amazon.com: Books	 Cambridge University Press (November 2, 2006)
0679721134	Amazon.com: Rules for Radicals (9780679721130): Saul Alinsky: Books	 Vintage (October 23, 1989)
0826425054	Working on a Dream: The Progressive Political Vision of Bruce Springsteen: David Masciotra: 9780826425058: Amazon.com: Books	 Continuum; 1 edition (January 28, 2010)
1568587147	Rebuild the Dream: Van Jones: 9781568587141: Amazon.com: Books	 Nation Books (April 3, 2012)
0816640866	Identity\Difference: Democratic Negotiations of Political Paradox, Expanded Edition: William E. Connolly: 9780816640867: Amazon.com: Books	 Univ Of Minnesota Press; Revised edition (August 14, 2002)
0674064305	Roosevelt&#39;s Purge: How FDR Fought to Change the Democratic Party: Susan Dunn: 9780674064300: Amazon.com: Books	 Belknap Press of Harvard University Press (May 7, 2012)
1847674321	Change We Can Believe In: Barack Obama&#39;s Plan to Renew America&#39;s Promise: Barack Obama: 9781847674326: Amazon.com: Books	 Canongate Books; First Edition edition (2008)
0670021334	The Audacity to Win: The Inside Story and Lessons of Barack Obama&#39;s Historic Victory: David Plouffe: 9780670021338: Amazon.com: Books	 Viking Adult; First Edition edition (November 3, 2009)
160846251X	Occupying Wall Street: The Inside Story of an Action that Changed America: Writers for the 99%, A.J. Bauer, Christine Baumgarthuber, Jed Bickman, Jeremy Breecher: 9781608462513: Amazon.com: Books	 Haymarket Books (April 3, 2012)
141659762X	Tear Down This Myth: How the Reagan Legacy Has Distorted Our Politics and Haunts Our Future: Will Bunch: 9781416597629: Amazon.com: Books	 Free Press; 1ST edition (February 3, 2009)
1427214751	Pity the Billionaire: The Hard-Times Swindle and the Unlikely Comeback of the Right: Thomas Frank: 9781427214751: Amazon.com: Books	 Macmillan Audio; Unabridged edition (January 3, 2012)
0312373902	Bloodthirsty Bitches and Pious Pimps of Power: The Rise and Risks of the New Conservative Hate Culture: Gerry Spence: 9780312373900: Amazon.com: Books	 St. Martin's Griffin; 1st edition (October 30, 2007)
1401939295	A Mindful Nation: How a Simple Practice Can Help Us Reduce Stress, Improve Performance, and Recapture the American Spirit: Tim Ryan: 9781401939298: Amazon.com: Books	 Hay House (March 27, 2012)
044653224X	Here Comes Trouble: Stories from My Life: Michael Moore: 9780446532242: Amazon.com: Books	 Grand Central Publishing; First Edition edition (September 13, 2011)
1584350563	The Porcelain Workshop: For a New Grammar of Politics (Semiotext(e) / Foreign Agents): Antonio Negri, Noura Wedell: 9781584350569: Amazon.com: Books	 Semiotext(e) (May 31, 2008)
0520249194	Liberalism for a New Century: Neil Jumonville, Kevin Mattson, E.J. Dionne: 9780520249196: Amazon.com: Books	 University of California Press; 1 edition (June 4, 2007)
1594201862	Angler: The Cheney Vice Presidency: Barton Gellman: 9781594201868: Amazon.com: Books	 Penguin Press HC, The; First Edition edition (September 16, 2008)
0465001033	Never Stop Running: Allard Lowenstein and the Struggle to Save American Liberalism: William Henry Chafe: 9780465001033: Amazon.com: Books	 Basic Books; First Edition edition (December 1993)
0312610548	Boiling Mad: Behind the Lines in Tea Party America: Kate Zernike: 9780312610548: Amazon.com: Books	 St. Martin's Griffin; First Edition edition (September 27, 2011)
1560258810	Sweet Jesus, I Hate Bill O&#39;Reilly: Joseph Minton Amann, Tom Breuer: 9781560258810: Amazon.com: Books	 Nation Books (March 22, 2006)
1426203616	Warriors in Uniform: The Legacy of American Indian Heroism: Herman J. Viola, Ben Nighthorse Campbell: Amazon.com: Books	 National Geographic (November 18, 2008)
0809327333	Our Culture of Pandering: Paul Simon: 9780809327331: Amazon.com: Books	 Southern Illinois University Press; 1st edition (August 10, 2006)
0143142720	The Audacity to Win: The Inside Story and Lessons of Barack Obama&#39;s Historic Victory: David Plouffe, Erik Davies: Amazon.com: Books	 Penguin Audio; Unabridged edition (November 12, 2009)
0979482291	Amazon.com: The Real McCain: Why Conservatives Don&#39;t Trust Him and Why Independents Shouldn&#39;t (9780979482298): Cliff Schecter: Books	 PoliPoint Press (May 1, 2008)
1612420613	Take Back Your Government: Robert A. Heinlein, Jr. William H. Patterson: 9781612420615: Amazon.com: Books	 Phoenix Pick (January 25, 2012)
0199261687	Liberalism, Constitutionalism, and Democracy: Russell Hardin: 9780199261680: Amazon.com: Books	 Oxford University Press, USA (August 14, 2003)
0393057755	Terror and Liberalism: Paul Berman: 9780393057751: Amazon.com: Books	 W. W. Norton & Company; First Edition edition (April 2003)
0684862352	Amazon.com: Now, Let Me Tell You What I Really Think (9780684862354): Chris Matthews: Books	 Free Press (August 27, 2002)
1455128562	Amazon.com: The Obama Hate Machine: The Lies, Distortions, and Personal Attacks on the President--and Who Is Behind Them (Library Edition) (9781455128563): Bill Press, Joe Barrett: Books	 Blackstone Audio, Inc.; Unabridged LIBRARY edition (January 31, 2012)
1560257636	Jesus Is Not a Republican: The Religious Right&#39;s War on America: Clint Willis, Nate Hardcastle: Amazon.com: Books	 Thunder's Mouth Press; 1st edition (October 6, 2005)
0060926430	Amazon.com: A People&#39;s History of the United States: 1492-Present (9780060926434): Howard Zinn: Books	 Perennial; Rev&Updtd edition (June 1995)
1566394694	No Mercy: How Conservative Think Tanks and Foundations Changed America&#39;s Social Agenda: Jean Stefancic, Richard Delgado: 9781566394697: Amazon.com: Books	 Temple Univ Pr (September 1996)
1594607265	Amazon.com: Alexis de Tocqueville and the New Science of Politics: An Interpretation of Democracy in America (9781594607264): John C. Koritansky: Books	 Carolina Academic Press; 2 edition (October 15, 2009)
0192891065	The Life and Times of Liberal Democracy (Opus Books): C. B. Macpherson: 9780192891068: Amazon.com: Books	 Oxford University Press, USA (January 5, 1978)
0141042451	The Presidents: The Transformation of the American Presidency from TheodoreRoosevelt to Barack: Stephen Graubard: 9780141042459: Amazon.com: Books	 Penguin Global (April 7, 2010)
0674574419	Amazon.com: Miles to Go: A Personal History of Social Policy (9780674574410): The Honorable Daniel Patrick Moynihan: Books	 Harvard University Press (October 1, 1997)
0399158227	What It Means to Be a Democrat: George McGovern: Amazon.com: Books	 Blue Rider Press (November 10, 2011)
0801435439	Rethinking Liberal Equality: From a &quot;Utopian&quot; Point of View: Andrew Levine: 9780801435430: Amazon.com: Books	 Cornell University Press; First Edition edition (October 1, 1998)
1451610378	God, No!: Signs You May Already Be an Atheist and Other Magical Tales: Penn Jillette: 9781451610376: Amazon.com: Books	 Simon & Schuster (June 5, 2012)
0813320518	Amazon.com: Without Justice For All: The New Liberalism And Our Retreat From Racial Equality (9780813320519): Adolph Reed Jr.: Books	 Westview Press (March 2001)
0691153965	Amazon.com: The Second Red Scare and the Unmaking of the New Deal Left (Politics and Society in Twentieth-Century America) (9780691153964): Landon R.Y. Storrs: Books	 Princeton University Press (October 28, 2012)
0385533888	Tears of a Clown: Glenn Beck and the Tea Bagging of America: Dana Milbank: 9780385533881: Amazon.com: Books	 Doubleday; First Edition edition (October 5, 2010)
1934386995	FU Conservatives: A journal for Liberals to destroy, rant and vent without getting arrested: Alex A. Lluch: 9781934386996: Amazon.com: Books	 WS Publishing Group; First Edition edition (June 16, 2010)
193339241X	Amazon.com: Crashing the Gate: Netroots, Grassroots, and the Rise of People-Powered Politics (9781933392417): Jerome Armstrong, Markos Moulitsas: Books	 Chelsea Green (September 1, 2006)
0446539252	True Compass: A Memoir: Edward M. Kennedy: Amazon.com: Books	 Twelve (September 14, 2009)
0670020915	Threshold: The Crisis of Western Culture: Thom Hartmann: Amazon.com: Books	 Viking Adult (July 23, 2009)
0525947647	Amazon.com: Lies and the Lying Liars Who Tell Them: A Fair and Balanced Look at the Right: Al Franken: Books	 Dutton Adult (August 21, 2003)
1616146702	Amazon.com: That&#39;s Not What They Meant!: Reclaiming the Founding Fathers from America&#39;s Right Wing (9781616146702): Michael Austin: Books	 Prometheus Books (September 18, 2012)
0873489675	Amazon.com: Capitalism&#39;s Long Hot Winter Has Begun, New International, No.12, 2005. (New International Series) (9780873489676): Jack Barnes: Books	 Pathfinder Press (January 1, 2005)
0979525756	Amazon.com: Darwin&#39;s Second Revolution (9780979525759): David Loye: Books	 Benjamin Franklin Press (October 30, 2010)
0873483030	Amazon.com: Reform or Revolution (9780873483032): Rosa Luxemburg: Books	 Pathfinder Pr; 2nd edition edition (June 1973)
0374532524	Interesting Times: Writings from a Turbulent Decade: George Packer: 9780374532529: Amazon.com: Books	 Farrar, Straus and Giroux (November 9, 2010)
088706387X	The Crisis of Liberal Democracy: A Straussian Perspective (Suny Series in Political Theory: Contemporary Issues): Kenneth L. Deutsch: 9780887063879: Amazon.com: Books	 State Univ of New York Pr (February 28, 1987)
1470159104	Hypocrisy, Inc.: How the Religious Right Fabricates Christian Values and Undermines Democracy: Rosemary Agonito: 9781470159108: Amazon.com: Books	 CreateSpace Independent Publishing Platform (April 19, 2012)
1844677540	The Spirit of Philadelphia: Social Justice vs. the Total Market: Alain Supiot: 9781844677542: Amazon.com: Books	 Verso; 1 edition (May 8, 2012)
0395957931	The Cycles of American History: Arthur M. Schlesinger Jr.: 0046442957939: Amazon.com: Books	 Mariner Books; 1 edition (June 1, 1999)
0816521751	Too Funny to Be President: Morris K. Udall: 9780816521753: Amazon.com: Books	 University of Arizona Press; 1 edition (February 2001)
1848606621	Amazon.com: Why Voice Matters: Culture and Politics After Neoliberalism (9781848606623): Nick Couldry: Books	 SAGE Publications Ltd; 1 edition (July 14, 2010)
1449597955	Amazon.com: Reflections on Evolutionary Activism: Essays, poems and prayers from an emerging field of sacred social change (9781449597955): Tom Atlee: Books	 CreateSpace Independent Publishing Platform (December 4, 2009)
0307395804	Grand Theft Jesus: The Hijacking of Religion in America: Robert S. McElvaine: 9780307395801: Amazon.com: Books	 Broadway; 1 Reprint edition (April 7, 2009)
0143037684	Homegrown Democrat: A Few Plain Thoughts from the Heart of America: Garrison Keillor: 9780143037682: Amazon.com: Books	 Penguin Books; Rev Upd edition (August 29, 2006)
098157694X	The Next Progressive Era: A Blueprint for Broad Prosperity: Phillip Longman, Ray Boshara: 9780981576947: Amazon.com: Books	 Polipoint Press; First Edition edition (April 2, 2009)
0385520344	The Great Derangement: A Terrifying True Story of War, Politics, and Religion at the Twilight of the American Empire: Matt Taibbi: 9780385520348: Amazon.com: Books	 Spiegel & Grau; 1St Edition edition (May 6, 2008)
0300180764	America the Possible: Manifesto for a New Economy (American Crisis): James Gustave Speth: 9780300180763: Amazon.com: Books	 Yale University Press (September 25, 2012)
0684825031	NEXT AMERICAN NATION: The New Nationalism and the Fourth American Revolution: Michael Lind: 9780684825038: Amazon.com: Books	 Free Press (July 5, 1996)
0307460983	Drift: The Unmooring of American Military Power: Rachel Maddow: 9780307460981: Amazon.com: Books	 Crown; First Edition edition (March 27, 2012)
006201126X	The Mendacity of Hope: Barack Obama and the Betrayal of American Liberalism: Roger D. Hodge: Amazon.com: Books	 Harper (October 5, 2010)
1568586590	Kabuki Democracy: The System vs. Barack Obama: Eric Alterman: 9781568586595: Amazon.com: Books	 Nation Books (January 11, 2011)
0060562978	Red, White &amp; Liberal : How Left Is Right &amp; Right Is Wrong: Alan Colmes: Amazon.com: Books	 William Morrow; 1 edition (October 21, 2003)
0822329689	Left Legalism/Left Critique: Wendy Brown, Janet Halley: 9780822329688: Amazon.com: Books	 Duke University Press Books (November 22, 2002)
0307408388	More Davids Than Goliaths: A Political Education: Harold Ford Jr.: Amazon.com: Books	 Crown; 1 edition (August 10, 2010)
0674833120	The Spirit of Liberalism: Harvey C. Mansfield Jr.: 9780674833128: Amazon.com: Books	 Harvard University Press (January 1979)
0312573774	Never Give In: Battling Cancer in the Senate: Sen. Arlen Specter, Frank J. Scaturro: Amazon.com: Books	 St. Martin's Griffin; First Edition edition (July 7, 2009)
1886249318	Amazon.com: Free Speech 101: The Utah Valley Uproar over Michael Moore (9781886249318): Joseph Vogel: Books	 Windriver Publishing (ID) (October 2, 2006)
0393329763	Kingdom Coming: The Rise of Christian Nationalism: Michelle Goldberg: Amazon.com: Books	 W. W. Norton & Company (April 17, 2007)
1849351104	Amazon.com: Hopeless: Barack Obama and the Politics of Illusion (9781849351102): Jeffrey St. Clair, Joshua Frank, Kevin Alexander Gray, Kathy Kelly, Ralph Nader: Books	 AK Press (May 15, 2012)
0812929136	Between Hope and History: William Jefferson Clinton: 9780812929133: Amazon.com: Books	 RANDOM HOUSE; 1st edition (September 1, 1996)
1608194388	Amazon.com: Our Divided Political Heart: The Battle for the American Idea in an Age of Discontent (9781608194384): E.J. Dionne: Books	 Bloomsbury USA; 1 edition (January 29, 2013)
159315660X	Keys to the Kingdom: Bob Graham: 9781593156602: Amazon.com: Books	 Vanguard Press; First Printing edition (June 7, 2011)
0141018275	Armed Madhouse: Greg Palast: 9780141018270: Amazon.com: Books	 Penguin; First Printing edition (2007)
1416552235	How to Rig an Election: Confessions of a Republican Operative: Allen Raymond, Ian Spiegelman: Amazon.com: Books	 Simon & Schuster; Reprint edition (September 2, 2008)
1594202362	¡OBÁMANOS!: The Birth of a New Political Era: Hendrik Hertzberg: Amazon.com: Books	 Penguin Press HC, The (October 29, 2009)
0440508649	Rush Limbaugh Is a Big Fat Idiot: Al Franken: 9780440508649: Amazon.com: Books	 Dell; twentieth edition (January 12, 1999)
1594865051	New Rules: Polite Musings from a Timid Observer: Bill Maher: 9781594865053: Amazon.com: Books	 Rodale Books (September 5, 2006)
1594514895	Red to Blue: Congressman Chris Van Hollen and Grassroots Politics: Sanford Gottlieb, Mike McCurry: 9781594514890: Amazon.com: Books	 Paradigm Publishers (April 30, 2009)
1595580166	Amazon.com: Tragedy and Farce: How the American Media Sell Wars, Spin Elections, and Destroy Democracy (9781595580160): John Nichols, Robert W. McChesney, Tom Tomorrow, Tim Robbins: Books	 New Press, The; First Edition edition (November 3, 2005)
1859848826	Waiting for the Barbarians: Lewis H. Lapman, Lewis Lapham: 9781859848821: Amazon.com: Books	 Verso; 1ST edition (November 30, 1997)
0446674710	The Year the Dream Died: Revisiting 1968 in America: Jules Witcover, David Halberstam: 9780446674713: Amazon.com: Books	 Grand Central Publishing; 1st edition (June 1, 1998)
0743277538	Take It Back: A Battle Plan for Democratic Victory: James Carville, Paul Begala: 9780743277532: Amazon.com: Books	 Simon & Schuster; First Trade edition (September 5, 2006)
0470395117	The Progressive Revolution: How the Best in America Came to Be: Michael Lux: 9780470395110: Amazon.com: Books	 Wiley (January 14, 2009)
1567511376	Amazon.com: Washington on $10 Million A Day: How Lobbyists Plunder the Nation (9781567511376): Ken Silverstein: Books	 Common Courage Press (July 1, 2002)
0452285216	Amazon.com: Lies: And the Lying Liars Who Tell Them: Al Franken: Books	 Plume (July 27, 2004)
0812977513	Unusually Stupid Politicians: Washington&#39;s Weak in Review: Kathryn Petras, Ross Petras: 9780812977516: Amazon.com: Books	 Villard (October 9, 2007)
0195340841	God&#39;s Own Party: The Making of the Christian Right: Daniel Williams: 9780195340846: Amazon.com: Books	 Oxford University Press, USA; 1St Edition edition (October 4, 2010)
1598870300	Thy Kingdom Come: An Evangelical&#39;s Lament: How the Religious Right Distorts the Faith and Threatens America: Randall Balmer, Jeff Woodman: Amazon.com: Books	 HighBridge Company; Unabridged edition (June 26, 2006)
0307379698	The New Hate: A History of Fear and Loathing on the Populist Right: Arthur Goldwag: 9780307379696: Amazon.com: Books	 Pantheon (February 7, 2012)
1595587195	Who&#39;s Afraid of Frances Fox Piven?: The Essential Writings of the Professor Glenn Beck Loves to Hate: Frances Fox Piven: 9781595587190: Amazon.com: Books	 New Press, The; 1 edition (August 9, 2011)
159486327X	Rumors of Our Progress Have Been Greatly Exaggerated: Why Women&#39;s Lives Aren&#39;t Getting Any Easier--And How We Can Make Real Progress For Ourselves and Our Daughters: Carolyn Maloney: Amazon.com: Books	 Modern Times; 1st edition (May 13, 2008)
031260629X	Toxic Talk: How the Radical Right Has Poisoned America&#39;s Airwaves: Bill Press: Amazon.com: Books	 Thomas Dunne Books; 1 edition (May 25, 2010)
1582436282	Amazon.com: Edward Kennedy: An Intimate Biography (9781582436289): Burton Hersh: Books	 Counterpoint (September 7, 2010)
1597772496	Yes We Can, (Expanded Edition): Speeches of Barack Obama: Barack Obama, Phoenix Books: Amazon.com: Books	 Phoenix Audio (February 1, 2009)
157392797X	Amazon.com: Close Encounters With the Religious Right: Journeys into the Twilight Zone of Religion and Politics (9781573927970): Rob Boston: Books	 Prometheus Books; 1St Edition edition (May 2000)
0060392452	Stupid White Men ...and Other Sorry Excuses for the State of the Nation!: Michael Moore: Amazon.com: Books	 Harper; 1 edition (February 19, 2002)
0312612141	Amazon.com: The Most Dangerous Man in America: Rush Limbaugh&#39;s Assault on Reason: John K. Wilson: Books	 Thomas Dunne Books (March 1, 2011)
1416569898	40 More Years: How the Democrats Will Rule the Next Generation: James Carville, Rebecca Buckwalter-Poza: Amazon.com: Books	 Simon & Schuster; 1 edition (May 5, 2009)
0743237536	The Pro-Growth Progressive: An Economic Strategy for Shared Prosperity: Gene Sperling: 9780743237536: Amazon.com: Books	 Simon & Schuster; First Edition edition (November 1, 2005)
0743289315	Lapdogs: How the Press Rolled Over for Bush: Eric Boehlert: 9780743289313: Amazon.com: Books	 Free Press (May 9, 2006)
0822345056	Democracy and Other Neoliberal Fantasies: Communicative Capitalism and Left Politics: Jodi Dean: 9780822345053: Amazon.com: Books	 Duke University Press Books; 1st unedited edition edition (September 2, 2009)
0801480728	Political Theory and the Displacement of Politics (Contestations: Cornell Studies in Political Theory): Bonnie Honig: 9780801480720: Amazon.com: Books	 Cornell University Press (April 15, 1993)
0814741061	Refugee Roulette: Disparities in Asylum Adjudication and Proposals for Reform: Jaya Ramji-Nogales, Andrew I. Schoenholtz, Philip G. Schrag, Edward M. Kennedy: 9780814741061: Amazon.com: Books	 NYU Press (April 29, 2011)
0739306596	Bushwhacked: Life in George W. Bush&#39;s America: Lou Dubose, Molly Ivins: 9780739306598: Amazon.com: Books	 Random House Audio Voices; Abridged edition (September 23, 2003)
1932360220	Wake Up, You&#39;re Liberal!: How We Can Take America Back from the Right: Ted Rall: 9781932360226: Amazon.com: Books	 Soft Skull Press (May 14, 2004)
0679462945	Amazon.com: The Conscience of a Liberal: Reclaiming the Compassionate Agenda (9780679462941): Paul Wellstone: Books	 Random House; 1st edition (May 15, 2001)
1451616651	Better Off Without &#39;Em: A Northern Manifesto for Southern Secession: Chuck Thompson: 9781451616651: Amazon.com: Books	 Simon & Schuster (August 14, 2012)
1591021146	Amazon.com: Why the Religious Right Is Wrong About Separation of Church and State (9781591021148): Rob Boston: Books	 Prometheus Books; 2 edition (July 2003)
