isbn	title	publisher
1416936599	I Hate Ann Coulter!: Unanimous: 9781416936596: Amazon.com: Books	 Gallery Books; Original edition (October 24, 2006)
1402203098	The Best Liberal Quotes Ever: William Martin: 9781402203091: Amazon.com: Books	 Sourcebooks, Inc. (August 1, 2004)
0743269276	The Essential America: Our Founders and the Liberal Tradition: George McGovern: 9780743269278: Amazon.com: Books	 Simon & Schuster; First Edition edition (July 20, 2004)
0740797565	Amazon.com: You Betcha!: The Witless Wisdom of Sarah Palin: Leland Gregory: Books	 Andrews McMeel Publishing; Original edition (July 13, 2010)
0865714428	The Better World Handbook : From Good Intentions to Everyday Actions: Ellis Jones, Ross Haenfler, Brett Johnson, Brian Klocke: 9780865714427: Amazon.com: Books	 New Society Publishers (October 1, 2001)
0316586994	A Dangerous Place: Daniel Patrick Moynihan: 9780316586993: Amazon.com: Books	 Little Brown & Company; First Edition edition (November 1978)
1118094514	The Republican Brain: The Science of Why They Deny Science- and Reality: Chris Mooney: 9781118094518: Amazon.com: Books	 Wiley; 1st edition (April 10, 2012)
081222129X	Amazon.com: The International Struggle for New Human Rights (Pennsylvania Studies in Human Rights) (9780812221299): Clifford Bob: Books	 University of Pennsylvania Press (July 26, 2010)
1604865016	1492-1992: The Legacy of Columbus (PM Audio): Howard Zinn: 9781604865011: Amazon.com: Books	 PM Press (November 21, 2011)
0199929068	God&#39;s Own Party: The Making of the Christian Right: Daniel K. Williams: 9780199929061: Amazon.com: Books	 Oxford University Press, USA; Reprint edition (June 12, 2012)
0745332536	The Islamophobia Industry: How the Right Manufactures Fear of Muslims: Nathan Lean, John L. Esposito: 9780745332536: Amazon.com: Books	 Pluto Press (September 18, 2012)
1859841775	Outsider in the House: Bernie Sanders, Huck Gutman: 9781859841778: Amazon.com: Books	 Verso (September 17, 1998)
0472031198	Paul Wellstone: The Life of a Passionate Progressive: Bill Lofy: 9780472031191: Amazon.com: Books	 University of Michigan Press (August 29, 2005)
023060319X	Amazon.com: Woman of the House: The Rise of Nancy Pelosi: Vincent Bzdek: Books	 Palgrave Macmillan; 1st edition (January 8, 2008)
0801860717	Amazon.com: Daniel Patrick Moynihan: The Intellectual in Public Life (Woodrow Wilson Centre Series) (9780801860713): Robert A. Katzmann: Books	 The Johns Hopkins University Press (August 17, 1998)
1401940544	Thank The Liberals**For Saving America: Alan Colmes: 9781401940546: Amazon.com: Books	 Hay House (August 27, 2012)
0446514942	Where the Buck Stops: The Personal and Private Writings of Harry S. Truman: Harry S. Truman, Margaret Truman: 9780446514941: Amazon.com: Books	 Warner Books; First Edition edition (October 1989)
0307237699	The Audacity of Hope: Thoughts on Reclaiming the American Dream: Barack Obama: Amazon.com: Books	 Crown; First Edition edition (October 17, 2006)
141431860X	UnChristian America: Living with Faith in a Nation That Was Never Under God: Michael Babcock: 9781414318608: Amazon.com: Books	 SaltRiver (July 23, 2008)
1595584714	Beyond the Echo Chamber: How a Networked Progressive Media Can Reshape American Politics: Jessica Clark, Tracy Van Slyke: Amazon.com: Books	 New Press, The (February 9, 2010)
0307237923	The Architect: Karl Rove and the Master Plan for Absolute Power: James Moore, Wayne Slater: 9780307237927: Amazon.com: Books	 Crown (September 5, 2006)
1401323774	Amazon.com: Dirty Sexy Politics: Meghan McCain: Books	 Hyperion (August 31, 2010)
0300080794	Amazon.com: Secrecy: The American Experience (9780300080797): The Honorable Daniel Patrick Moynihan: Books	 Yale University Press (December 1999)
0743528344	Living History: Hillary Rodham Clinton, Hillary Clinton: 9780743528344: Amazon.com: Books	 Simon & Schuster Audio; Abridged edition (June 9, 2003)
1586487604	Amazon.com: The Plan: Big Ideas for America: Rahm Emanuel, Bruce Reed: Books	 PublicAffairs; Reprint edition (January 5, 2009)
0816626693	Ethos Of Pluralization (Barrows Lectures): William Connolly: 9780816626694: Amazon.com: Books	 Univ Of Minnesota Press; 1 edition (August 30, 1995)
0195383737	Speaker Nancy Pelosi and the New American Politics: Ronald M. Peters Jr., Cindy Simon Rosenthal: 9780195383737: Amazon.com: Books	 Oxford University Press, USA (March 1, 2010)
1551117002	The Institutions of Liberal Democratic States: Munroe Eagles, Christopher Holoman, Larry Johnston: 9781551117003: Amazon.com: Books	 University of Toronto Press, Higher Education Division; 1ST edition (September 1, 2004)
0470643927	Amazon.com: The Fifteen Biggest Lies about the Economy: And Everything Else the Right Doesn&#39;t Want You to Know about Taxes, Jobs, and Corporate America (9780470643921): Joshua Holland: Books	 Wiley; 1 edition (September 28, 2010)
0931761859	The State of Black America 2007: Portrait of the Black Male: National Urban League, Stephanie J. Jones, Sen. Barack Obama: 9780931761850: Amazon.com: Books	 Beckham Publications Group; 1 edition (April 17, 2007)
0393035484	Liberty Justice Order: Essays on Past Politics: John Morton Blum: 9780393035483: Amazon.com: Books	 W W Norton & Co Inc; 1st edition (December 1993)
0978843185	Dispatches from the Religious Left: The Future of Faith and Politics in America: Frederick Clarkson: 9780978843182: Amazon.com: Books	 Ig Publishing (October 1, 2008)
0979585295	Amazon.com: Listen to Your Mother: Stand Up Straight: How Progressives Can Win (9780979585296): Robert Creamer: Books	 Seven Locks Press (November 20, 2007)
1568586442	Amazon.com: Death of the Liberal Class (9781568586441): Chris Hedges: Books	 Nation Books; First Edition, First Printing. edition (October 17, 2010)
0520265548	The Fireside Conversations: America Responds to FDR during the Great Depression: Lawrence W. Levine, Cornelia R. Levine, Michæl Kazin: 9780520265547: Amazon.com: Books	 University of California Press; Reprint edition (September 7, 2010)
157675345X	Hidden Power: What You Need to Know to Save Our Democracy (Bk Currents): Charles Derber: 9781576753453: Amazon.com: Books	 Berrett-Koehler Publishers (September 1, 2005)
0268038031	Philosophy Of Democratic Government (Charles R. Walgreen Foundation Lectures): Yves R. Simon: 9780268038038: Amazon.com: Books	 University of Notre Dame Press (September 30, 1993)
0813543436	Rebels All!: A Short History of the Conservative Mind in Postwar America (Ideas in Action): Kevin Mattson: 9780813543437: Amazon.com: Books	 Rutgers University Press (July 30, 2008)
0743280768	American Armageddon: How the Delusions of the Neoconservatives and the Christian Right Triggered the Descent of America--and Still Imperil Our Future: Craig Unger: Amazon.com: Books	 Scribner (June 24, 2008)
030726677X	The Future of Liberalism: Alan Wolfe: Amazon.com: Books	 Knopf; First Edition edition (February 3, 2009)
0252075110	Women for President: Media Bias in Eight Campaigns: Erika Falk: 9780252075117: Amazon.com: Books	 University of Illinois Press; 2nd Printing edition (December 18, 2007)
046508186X	Amazon.com: Freedom&#39;s Power: The True Force of Liberalism (9780465081868): Paul Starr: Books	 Basic Books; 1ST edition (April 3, 2007)
0812243757	Amazon.com: An Army of Lions: The Civil Rights Struggle Before the NAACP (Politics and Culture in Modern America) (9780812243758): Shawn Leigh Alexander: Books	 University of Pennsylvania Press (November 14, 2011)
0739366416	The Audacity of Hope: Thoughts on Reclaiming the American Dream: Barack Obama: 9780739366417: Amazon.com: Books	 RH Audio; Abridged edition (November 6, 2007)
0385523289	The Thumpin&#39;: How Rahm Emanuel and the Democrats Learned to Be Ruthless and Ended the Republican Revolution: Naftali Bendavid: Amazon.com: Books	 Doubleday (May 8, 2007)
1560009632	Progressive Democracy (Classics in Social Science): Herbert Croly, Jr., Sidney A. Pearson: 9781560009634: Amazon.com: Books	 Transaction Publishers (January 1, 1998)
0307382559	The Power of Progress: How America&#39;s Progressives Can (Once Again) Save Our Economy, Our Climate, and Our Country: John Podesta: 9780307382559: Amazon.com: Books	 Crown; 1 edition (August 19, 2008)
0981576982	The Eliminationists: How Hate Talk Radicalized the American Right: David Neiwert: 9780981576985: Amazon.com: Books	 Paradigm Publishers; 1ST edition (May 2009)
0670018201	Broken Government: How Republican Rule Destroyed the Legislative, Executive, and Judicial Branches: John W. Dean: Amazon.com: Books	 Viking Adult (September 11, 2007)
0767928369	A Time to Fight: Reclaiming a Fair and Just America: Jim Webb: 9780767928366: Amazon.com: Books	 Broadway (May 12, 2009)
0141039817	Mike&#39;s Election Guide 2008: Michael Moore: 9780141039817: Amazon.com: Books	 Penguin (January 1, 2008)
0029276012	James Madison: The Founding Father: Robert Allen Rutland: 9780029276013: Amazon.com: Books	 Atheneum (October 1987)
0743260864	Historia Viva (Living History) (Spanish Edition): Hillary Rodham Clinton: Amazon.com: Books	 Touchstone; Spanish edition (April 20, 2004)
0700615466	The Liberals&#39; Moment: The McGovern Insurgency and the Identity Crisis of the Democratic Party: Bruce Miroff: 9780700615469: Amazon.com: Books	 Univ Pr of Kansas (September 25, 2007)
0143116169	Angler: The Cheney Vice Presidency: Barton Gellman: Amazon.com: Books	 Penguin Books; Reprint edition (August 25, 2009)
0520224027	The Price of Dissent: Testimonies to Political Repression in America: Bud Schultz: 9780520224025: Amazon.com: Books	 University of California Press; First Printing edition (November 5, 2001)
081474074X	Refugee Roulette: Disparities in Asylum Adjudication and Proposals for Reform: Jaya Ramji-Nogales, Andrew I. Schoenholtz, Philip G. Schrag, Edward M. Kennedy: 9780814740743: Amazon.com: Books	 NYU Press (September 30, 2009)
0393337669	Invisible Hands: The Businessmen&#39;s Crusade Against the New Deal: Kim Phillips-Fein: 9780393337662: Amazon.com: Books	 W. W. Norton & Company; Reprint edition (January 11, 2010)
0292709757	Changing the Face of Power: Women in the U.S. Senate (Focus on American History Series): Melina Mara, Helen Thomas, Senator Barbara Mikulski, Senator Kay Bailey Hutchison, Cokie Roberts: 9780292709751: Amazon.com: Books	 University of Texas Press (October 1, 2005)
031242647X	Whose Freedom?: The Battle over America&#39;s Most Important Idea: George Lakoff: 9780312426477: Amazon.com: Books	 Picador; Reprint edition (May 15, 2007)
1250031028	The Obama Hate Machine: The Lies, Distortions, and Personal Attacks on the President---and Who Is Behind Them: Bill Press: 9781250031020: Amazon.com: Books	 St. Martin's Griffin (August 21, 2012)
0060746882	Crimes Against Nature: How George W. Bush and His Corporate Pals Are Plundering the Country and Hijacking Our Democracy: Jr., Robert F. Kennedy: Amazon.com: Books	 Harper Perennial (July 5, 2005)
080704427X	Un-Making Law: The Conservative Campaign to Roll Back the Common Law: Jay Feinman: 9780807044278: Amazon.com: Books	 Beacon Press (October 12, 2005)
0385722117	Legal Lynching: The Death Penalty and America&#39;s Future: Rev. Jesse L. Jackson, Bruce Shapiro, Jr. Jesse L. Jackson: 9780385722117: Amazon.com: Books	 Anchor (January 7, 2003)
0230603963	McCain: The Myth of a Maverick: Matt Welch: Amazon.com: Books	 Palgrave Macmillan; 1st edition (October 16, 2007)
0230600468	The Confiscation of American Prosperity: From Right-Wing Extremism and Economic Ideology to the Next Great Depression: Michael Perelman: 9780230600461: Amazon.com: Books	 Palgrave Macmillan; First Edition edition (October 2, 2007)
0374527784	Blood of the Liberals: George Packer: 9780374527785: Amazon.com: Books	 Farrar, Straus and Giroux; First Edition edition (August 1, 2001)
0060559799	The Family: The Secret Fundamentalism at the Heart of American Power: Jeff Sharlet: Amazon.com: Books	 Harper (May 20, 2008)
0465083269	Radicals in Robes: Why Extreme Right-Wing Courts Are Wrong for America: Cass R. Sunstein: Amazon.com: Books	 Basic Books; annotated edition edition (September 6, 2005)
0743286529	Foxes in the Henhouse: How the Republicans Stole the South and the Heartland and What the Democrats Must Do to Run &#39;em Out: Steve Jarding, Dave &quot;Mudcat&quot; Saunders, Bob Kerrey: 9780743286527: Amazon.com: Books	 Touchstone (October 10, 2006)
0307455874	Amazon.com: The Audacity of Hope: Thoughts on Reclaiming the American Dream (Vintage) (9780307455871): Barack Obama: Books	 Vintage; Reprint edition (July 15, 2008)
0765806665	True Tolerance: Liberalism and the Necessity of Judgment: J. Budziszewski: 9780765806666: Amazon.com: Books	 Transaction Publishers (December 1, 1999)
0679754873	You Got to Dance with Them What Brung You: Molly Ivins: 9780679754879: Amazon.com: Books	 Vintage; 1st Vintage Books ed edition (February 2, 1999)
0061843717	Edward M. Kennedy: A Biography: Adam Clymer: Amazon.com: Books	 Harper Perennial; 1 Updated edition (June 23, 2009)
0300108702	Off Center: The Republican Revolution and the Erosion of American Democracy: Professor Jacob S. Hacker, Professor Paul Pierson: 9780300108705: Amazon.com: Books	 Yale University Press (October 20, 2005)
0470173696	The Worst Person In the World: And 202 Strong Contenders: Keith Olbermann: 9780470173695: Amazon.com: Books	 Wiley; Reprint edition (September 10, 2007)
097719728X	Amazon.com: Steeplejacking: How the Christian Right is Hijacking Mainstream Religion (9780977197286): Sheldon Culver, John Dorhauer, Frederick Clarkson, Michael Goldberg: Books	 Ig Publishing; 1st Pbk. Ed edition (June 1, 2007)
0307279588	The Fox Effect: How Roger Ailes Turned a Network into a Propaganda Machine: David Brock, Ari Rabin-Havt, Media Matters for America: 9780307279583: Amazon.com: Books	 Anchor; Original edition (February 21, 2012)
0385484046	Hard Left: Tavis Smiley: 9780385484046: Amazon.com: Books	 Doubleday; 1St Edition edition (May 1, 1996)
0307717429	Revival: The Struggle for Survival Inside the Obama White House: Richard Wolffe: 9780307717429: Amazon.com: Books	 Broadway; Reprint edition (November 1, 2011)
0807123668	From George Wallace to Newt Gingrich: Race in the Conservative Counterrevolution, 1963-1994: Dan T. Carter: 9780807123669: Amazon.com: Books	 Louisiana State Univ Pr (April 1999)
0393076385	Amazon.com: Right Star Rising: A New Politics, 1974-1980 (9780393076387): Laura Kalman: Books	 W. W. Norton & Company (June 28, 2010)
0231702280	American Neoconservatism: The Politics and Culture of a Reactionary Idealism (Columbia/Hurst): Jean-Francois Drolet: 9780231702287: Amazon.com: Books	 Columbia University Press; First Edition edition (July 26, 2011)
1608461424	Autoworkers Under the Gun: A Shop-Floor View of the End of the American Dream: Gregg Shotwell, Lee Sustar, Jerry Tucker: 9781608461424: Amazon.com: Books	 Haymarket Books; 1 edition (February 14, 2012)
0553110748	John Glenn: A Memoir: John Glenn, Nick Taylor: 9780553110746: Amazon.com: Books	 Bantam (November 2, 1999)
160635051X	Amazon.com: The Admirable Radical: Staughton Lynd and Cold War Dissent, 1945-1970 (9781606350515): Carl Mirra, Howard Zinn: Books	 Kent State University Press; 3 Revised edition (April 1, 2010)
0670023434	The Cause: The Fight for American Liberalism from Franklin Roosevelt to Barack Obama: Eric Alterman, Kevin Mattson: 9780670023431: Amazon.com: Books	 Viking Adult (April 12, 2012)
0745644848	Why America Needs a Left: A Historical Argument: Eli Zaretsky: 9780745644844: Amazon.com: Books	 Polity; 1 edition (March 20, 2012)
0415907497	Official Knowledge: Democratic Education in a Conservative Age: Michael W. Apple: 9780415907491: Amazon.com: Books	 Routledge; 1 edition (March 1993)
0465005209	Thy Kingdom Come: How the Religious Right Distorts Faith and Threatens America: Randall Balmer: 9780465005208: Amazon.com: Books	 Basic Books; Reprint edition (September 25, 2007)
1576754596	Framing the Future: How Progressive Values Can Win Elections and Influence People (BK Currents): Bernie Horn: 9781576754597: Amazon.com: Books	 Berrett-Koehler Publishers (January 1, 2008)
0822958082	Amazon.com: Of Kennedys And Kings: Making Sense of the Sixties (9780822958086): Harris Wofford: Books	 University of Pittsburgh Press; 1 edition (October 16, 1992)
0812244419	Moral Minority: The Evangelical Left in an Age of Conservatism (Politics and Culture in Modern America): David R. Swartz: 9780812244410: Amazon.com: Books	 University of Pennsylvania Press (September 10, 2012)
0978843134	Youth to Power: How Today&#39;s Young Voters Are Building Tomorrow&#39;s Progressive Majority: Michael Connery: 9780978843137: Amazon.com: Books	 Ig Publishing (February 1, 2008)
0393059421	Losing America: Confronting a Reckless and Arrogant Presidency: Robert C. Byrd: 9780393059427: Amazon.com: Books	 W. W. Norton & Company (July 2004)
0252036867	Making Sense of American Liberalism: Jonathan Bell, Timothy Stanley: 9780252036866: Amazon.com: Books	 University of Illinois Press; 1st Edition edition (March 20, 2012)
1932528059	Neo-Conned! Again: Hypocrisy, Lawlessness, and the Rape of Iraq: D. Liam O&#39;Huallachain, J. Forrest Sharpe, Scott Ritter, Joseph Cirincione: 9781932528053: Amazon.com: Books	 Ihs Press; First edition. edition (December 15, 2005)
0452285658	Thieves in High Places: They&#39;ve Stolen Our Country and It&#39;s Time to Take It Back: Jim Hightower: Amazon.com: Books	 Plume (June 29, 2004)
0465041868	The Disappearing Liberal Intellectual: Eric Lott: 9780465041862: Amazon.com: Books	 Basic Books (March 21, 2006)
0299225402	Raising Hell for Justice: The Washington Battles of a Heartland Progressive: David Obey: 9780299225407: Amazon.com: Books	 University of Wisconsin Press; 1 edition (August 15, 2007)
0436205394	What&#39;s the Matter With America?: Thomas Frank: 9780436205392: Amazon.com: Books	 Secker & Warburg (September 2, 2004)
193185999X	Breaking the Sound Barrier: Amy Goodman, Bill Moyers: Amazon.com: Books	 Haymarket Books (October 1, 2009)
0312315600	Big Lies: The Right-Wing Propaganda Machine and How It Distorts the Truth: Joe Conason: 9780312315603: Amazon.com: Books	 Thomas Dunne Books; 1st edition (September 1, 2003)
0674574400	Miles to Go: A Personal History of Social Policy: The Honorable Daniel Patrick Moynihan: 9780674574403: Amazon.com: Books	 Harvard University Press; First Edition edition (October 1, 1996)
0984934014	The Magic Number: Inside Obama&#39;s Chase for the Presidential Nomination: Jeff Berman: 9780984934010: Amazon.com: Books	 Ordway House LLC (January 11, 2012)
1859840922	Washington Babylon: Alexander Cockburn, Ken Silverstein: 9781859840924: Amazon.com: Books	 Verso Books; First Edition edition (April 1996)
0300077564	Secrecy: The American Experience: The Honorable Daniel Patrick Moynihan: 9780300077568: Amazon.com: Books	 Yale University Press; First Edition edition (September 9, 1998)
0307408027	Great American Hypocrites: Toppling the Big Myths of Republican Politics: Glenn Greenwald: 9780307408020: Amazon.com: Books	 Crown (April 15, 2008)
0393013308	Amazon.com: The Progressive Presidents: Theodore Roosevelt, Woodrow Wilson, Franklin D. Roosevelt, Lyndon B. Johnson (9780393013306): John Morton Blum: Books	 WW Norton & Co; 1st edition (October 30, 1980)
0674635752	On the Law of Nations: The Honorable Daniel Patrick Moynihan: 9780674635753: Amazon.com: Books	 Harvard University Press; First Edition, First Printing edition (September 12, 1990)
0674951964	Whose Votes Count?: Affirmative Action and Minority Voting Rights (Twentieth Century Fund Books/Reports/Studies): Abigail M. Thernstrom: 9780674951969: Amazon.com: Books	 Harvard University Press (January 1, 1989)
0300143222	Thinking Politically: Essays in Political Theory: Michael Walzer, David Miller: 9780300143225: Amazon.com: Books	 Yale University Press (February 24, 2009)
0312356005	Righteous Warrior: Jesse Helms and the Rise of Modern Conservatism: William A. Link: Amazon.com: Books	 St. Martin's Press; 1st edition (February 5, 2008)
0743297865	The Party Faithful: How and Why Democrats Are Closing the God Gap: Amy Sullivan: 9780743297868: Amazon.com: Books	 Scribner; First Edition edition (February 19, 2008)
0812221273	Amazon.com: Advocating Dignity: Human Rights Mobilizations in Global Politics (Pennsylvania Studies in Human Rights) (9780812221275): Jean H. Quataert: Books	 University of Pennsylvania Press (November 24, 2010)
0143118080	Amazon.com: The Audacity to Win: How Obama Won and How We Can Beat the Party of Limbaugh, Beck, and Palin (9780143118084): David Plouffe: Books	 Penguin Books; Updated edition (August 31, 2010)
067973418X	Let Them Call Me Rebel: Saul Alinsky: His Life and Legacy: Sanford D. Horwitt: 9780679734185: Amazon.com: Books	 Vintage (March 31, 1992)
1586487191	The Practical Progressive: How to Build a Twenty-first Century Political Movement: Erica Payne: Amazon.com: Books	 PublicAffairs (August 11, 2008)
0700617027	Kennedy vs. Carter: The 1980 Battle for the Democratic Party&#39;s Soul: Timothy Stanley: 9780700617029: Amazon.com: Books	 University Press of Kansas; 1 edition (March 1, 2010)
156511891X	Reason: Why Liberals Will Win the Battle for America: Robert B. Reich: 9781565118911: Amazon.com: Books	 HighBridge Company; Unabridged edition (May 10, 2004)
1560256141	The I Hate Ann Coulter, Bill O&#39;Reilly, Rush Limbaugh, Michael Savage, Sean Hannity. . . Reader: The Hideous Truth About America&#39;s Ugliest Conservatives: Clint Willis: Amazon.com: Books	None
0743562607	It Takes a Village: Hillary Rodham Clinton: Amazon.com: Books	 Simon & Schuster Audio; 10 Abr Anv edition (December 12, 2006)
0156007088	Walking with the Wind: A Memoir of the Movement (Harvest Book): John Lewis, Michael D&#39;Orso: Amazon.com: Books	 Harvest Books (October 18, 1999)
0307952525	While America Sleeps: A Wake-up Call for the Post-9/11 Era: Russ Feingold: 9780307952523: Amazon.com: Books	 Crown; First Edition edition (February 21, 2012)
0521482623	Fulbright: A Biography: Randall Bennett Woods: 9780521482622: Amazon.com: Books	 Cambridge University Press; First Edition edition (June 30, 1995)
1591023602	Republican Like Me: Infiltrating Red-state, White-ass, And Blue-suit America: Harmon Leon: 9781591023609: Amazon.com: Books	 Prometheus Books; First Edition edition (November 7, 2005)
0812981030	The Death of Conservatism: A Movement and Its Consequences: Sam Tanenhaus: 9780812981032: Amazon.com: Books	 Random House Trade Paperbacks (October 19, 2010)
0811864278	Blind Trust: Barbara Boxer: Amazon.com: Books	 Chronicle Books (July 22, 2009)
0195387961	The Constitution in 2020: Jack M. Balkin, Reva B. Siegel: 9780195387964: Amazon.com: Books	 Oxford University Press, USA; 1 edition (May 26, 2009)
0307346544	Piety &amp; Politics: The Right-Wing Assault on Religious Freedom: Barry W. Lynn: 9780307346544: Amazon.com: Books	 Harmony; First Edition edition (October 3, 2006)
1896357008	Progress Without People: New Technology, Unemployment, and the Message of Resistance: David F. Noble: 9781896357003: Amazon.com: Books	 Between the Lines (May 2, 1995)
0817308431	Amazon.com: Earl Browder: The Failure of American Communism (9780817308438): James G. Ryan: Books	 University of Alabama Press (February 1, 1997)
1419644386	Liars For Jesus: The Religious Right&#39;s Alternate Version of American History Vol. 1: Chris Rodda: 9781419644382: Amazon.com: Books	 BookSurge Publishing; 1ST edition (August 10, 2006)
0806142022	A Letter to America: David L. Boren: 9780806142029: Amazon.com: Books	 University of Oklahoma Press; Reprint edition (February 15, 2011)
0816670404	Crossing the Barriers: The Autobiography of Allan H. Spear: Allan H. Spear, John Milton, Barney Frank: 9780816670406: Amazon.com: Books	 Univ Of Minnesota Press (October 29, 2010)
1935928236	At the Tea Party: The Wing Nuts, Whack Jobs and Whitey-whiteness of the New Republican Right - And Why We Should Take it Seriously: Laura Flanders: 9781935928232: Amazon.com: Books	 OR Books; 1ST edition (November 1, 2010)
0805090142	Amazon.com: Blue Dixie: Awakening the South&#39;s Democratic Majority: Bob Moser: Books	 Holt Paperbacks; First Edition edition (April 27, 2009)
0143143581	Angler: The Cheney Vice Presidency: Barton Gellman: Amazon.com: Books	 Penguin Audio; Unabridged edition (September 16, 2008)
1932543236	Road to Freedom: Photographs of the Civil Rights Movement, 1956-1968: Julian Cox, Charles Johnson, John Lewis: 9781932543230: Amazon.com: Books	 High Museum of Art; First Edition edition (August 1, 2008)
0061133019	100 Ways America Is Screwing Up the World: John Tirman, Howard Zinn: 9780061133015: Amazon.com: Books	 Harper Perennial (August 8, 2006)
0520043871	Corporate Liberalism: The Origins of Modern American Political Theory, 1890-1920: R. Jeffrey Lustig: 9780520043879: Amazon.com: Books	 University of California Press (September 1983)
1565841719	A People&#39;s History of the United States: The Wall Charts (New Press People&#39;s History): Howard Zinn, George Kirschner: 9781565841710: Amazon.com: Books	 New Press, The; Wal Chrt edition (October 1, 1995)
0060846712	F.U.B.A.R.: America&#39;s Right-Wing Nightmare: Sam Seder, Stephen Sherrill: Amazon.com: Books	 HarperCollins (May 23, 2006)
145161036X	God, No!: Signs You May Already Be an Atheist and Other Magical Tales: Penn Jillette: 9781451610369: Amazon.com: Books	 Simon & Schuster; First Edition edition (August 16, 2011)
0860916472	Capitalism, Socialism, Ecology: André Gorz, Chris Turner: 9780860916475: Amazon.com: Books	 Verso; First Edition edition (July 1, 1994)
0452296307	Threshold: The Progressive Plan to Pull America Back from the Brink: Thom Hartmann: Amazon.com: Books	 Plume (June 29, 2010)
1567510787	Facing the Wrath: Confronting the Right in Dangerous Times: Sara Diamond: 9781567510782: Amazon.com: Books	 Common Courage Press (July 1, 2002)
1600247547	True Compass: A Memoir: Edward M. Kennedy, John Bedford Lloyd: 9781600247545: Amazon.com: Books	 Twelve; Unabridged edition (September 14, 2009)
