isbn	title	publisher
1400048753	The Republican Noise Machine : Right-Wing Media and How It Corrupts Democracy: David Brock: Amazon.com: Books	 Crown; First Edition edition (May 18, 2004)
0198296347	The End of Class Politics?: Class Voting in Comparative Context: Geoffrey Evans: 9780198296348: Amazon.com: Books	 Oxford University Press, USA (December 23, 1999)
0465045804	Fooled Again: The Real Case for Electoral Reform: Mark Crispin Miller: Amazon.com: Books	 Basic Books; annotated edition edition (June 12, 2007)
192946245X	Amazon.com: Black Box Voting: Ballot Tampering in the 21st Century (9781929462452): Bev Harris: Books	 Elon House/Plan Nine (July 2003)
0641863950	The Truth (with jokes): Al Franken: 9780641863950: Amazon.com: Books	 Dutton Adult (October 25, 2005)
019959385X	Justice in a Globalized World: A Normative Framework: Laura Valentini: 9780199593859: Amazon.com: Books	 Oxford University Press, USA (March 2, 2012)
0307395278	Redneck Boy in the Promised Land: The Confessions of &quot;Crazy Cooter&quot;: Ben Jones: 9780307395276: Amazon.com: Books	 Crown; 1 edition (June 3, 2008)
0275998665	Amazon.com: A Liberal Tool Kit: Progressive Responses to Conservative Arguments (9780275998660): David Coates: Books	 Praeger (July 30, 2007)
1403968519	The Bush Betrayal: James Bovard: 9781403968517: Amazon.com: Books	 Palgrave Macmillan (August 25, 2005)
1595265708	Amazon.com: Strange Liberators: Militarism, Mayhem, and the Pursuit of Profit (9781595265708): Gregory Elich, Michael Parenti, Mickey Z: Books	 Llumina Press (May 12, 2006)
0976062186	Jacked: How &quot;Conservatives&quot; Are Picking Your Pocket (Whether You Voted for Them or Not): Nomi Prins: 9780976062189: Amazon.com: Books	 Polipoint Press (September 1, 2006)
0393327019	Losing America: Confronting a Reckless and Arrogant Presidency: Robert C. Byrd: 9780393327014: Amazon.com: Books	 W. W. Norton & Company (April 25, 2005)
0316091073	C Street: The Fundamentalist Threat to American Democracy: Jeff Sharlet: Amazon.com: Books	 Little, Brown and Company; 1 edition (September 27, 2010)
1560255838	Amazon.com: Taking Back America: And Taking Down the Radical Right (Nation Books) (9781560255833): Katrina vanden Heuvel, Robert L. Borosage: Books	 Nation Books; First Printing edition (March 1, 2004)
1442335262	Obama&#39;s Wars: Bob Woodward, Boyd Gaines: Amazon.com: Books	 Simon & Schuster Audio; Abridged edition (September 27, 2010)
0307408663	Great American Hypocrites: Toppling the Big Myths of Republican Politics: Glenn Greenwald: 9780307408662: Amazon.com: Books	 Broadway (October 7, 2008)
1573927538	Liberalism and Social Action (Great Books in Philosophy): John Dewey: 9781573927536: Amazon.com: Books	 Prometheus Books (November 1999)
0822342723	Capitalism and Christianity, American Style: William E. Connolly: 9780822342724: Amazon.com: Books	 Duke University Press Books (April 9, 2008)
0939680297	Amazon.com: The Spiritual Dimension of Green Politics (9780939680290): Charlene Spretnak: Books	 Bear & Co; Margin Notes edition (December 1986)
0745330061	Barack Obama and Twenty-first Century Politics: A Revolutionary Moment in the USA: Horace Campbell: 9780745330068: Amazon.com: Books	 Pluto Press; 1 edition (August 15, 2010)
0691091811	Latin America at the End of Politics: Forrest D. Colburn: 9780691091815: Amazon.com: Books	 Princeton University Press (February 11, 2002)
0226993329	Amazon.com: The Truth about Leo Strauss: Political Philosophy and American Democracy (9780226993324): Catherine H. Zuckert, Michael Zuckert: Books	 University Of Chicago Press (September 25, 2006)
0979472792	Barack Obama: The Official Inaugural Book: David Hume Kennerly, Robert McNeely, Pete Souza, Tom Brokaw, John Lewis, Douglas Brinkley: 9780979472794: Amazon.com: Books	 Five Ties Publishing; First edition (May 1, 2009)
1449409849	Stupid Conservatives: Weird and Wacky Tales from the Right Wing: Leland Gregory: 9781449409845: Amazon.com: Books	 Andrews McMeel Publishing; Original edition (April 10, 2012)
069102913X	The Idea of a Liberal Theory: David Johnston: 9780691029139: Amazon.com: Books	 Princeton University Press (July 8, 1996)
1427204543	The Wrecking Crew: How Conservatives Rule: Thomas Frank, Oliver Wyman: Amazon.com: Books	 Macmillan Audio; Unabridged edition (August 5, 2008)
0470614471	Amazon.com: Pitchforks and Torches: The Worst of the Worst, from Beck, Bill, and Bush to Palin and Other Posturing Republicans (9780470614471): Keith Olbermann: Books	 Wiley; 1 edition (October 26, 2010)
0691148406	The Making of Modern Liberalism: Alan Ryan: 9780691148403: Amazon.com: Books	 Princeton University Press (August 5, 2012)
1611203066	Death of the Liberal Class: Chris Hedges: 9781611203066: Amazon.com: Books	 Dreamscape Media; Unabridged edition (October 19, 2010)
0812219902	Formative Acts: American Politics in the Making: Stephen Skowronek, Matthew Glassman: 9780812219906: Amazon.com: Books	 University of Pennsylvania Press (August 20, 2008)
1416575189	An Amazing Adventure: Joe and Hadassah&#39;s Personal Notes on the 2000 Campaign: Joseph I. Lieberman, Hadassah Lieberman, Sarah Crichton: 9781416575184: Amazon.com: Books	 Simon & Schuster (August 24, 2007)
1586484508	Amazon.com: Five Days In Philadelphia: 1940, Wendell Willkie, FDR, and the Political Convention that Freed FDR to Win World War II (9781586484507): Charles Peters: Books	 PublicAffairs (June 27, 2006)
026257022X	Beyond the Melting Pot, Second Edition: The Negroes, Puerto Ricans, Jews, Italians, and Irish of New York City: Nathan Glazer, Daniel P. Moynihan: 9780262570220: Amazon.com: Books	 The MIT Press; second edition edition (June 15, 1970)
081222079X	Amazon.com: Bringing Human Rights Home: A History of Human Rights in the United States (Pennsylvania Studies in Human Rights) (9780812220797): Cynthia Soohoo, Catherine Albisa, Martha F. Davis: Books	 University of Pennsylvania Press; Abridged Edition edition (November 3, 2009)
0230112331	Taking a Stand: The Evolution of Human Rights: Juan E. Méndez, Marjory Wentworth: Amazon.com: Books	 Palgrave Macmillan (September 27, 2011)
0060756047	The Good Fight: Declare Your Independence and Close the Democracy Gap: Ralph Nader: 9780060756048: Amazon.com: Books	 Regan Books (July 6, 2004)
0465081878	Freedom&#39;s Power: The History and Promise of Liberalism: Paul Starr: Amazon.com: Books	 Basic Books; Reprint edition (August 26, 2008)
0425245330	Then Everything Changed: Stunning Alternate Histories of American Politics: JFK, RFK, Carter, Ford, Reagan: Jeff Greenfield: 9780425245330: Amazon.com: Books	 Berkley Trade; Reprint edition (February 7, 2012)
039915499X	Amazon.com: The Good Fight (9780399154997): Harry Reid, Mark Warren: Books	 Putnam Adult; First Printing edition (May 1, 2008)
074324303X	Nixonland: The Rise of a President and the Fracturing of America: Rick Perlstein: Amazon.com: Books	 Scribner; Reprint edition (April 14, 2009)
0847688275	The Essential Communitarian Reader: Amitai Etzioni, Ronald Bayer, Benjamin R. Barber, Daniel A. Bell, Robert N. Bellah, Senator Bill Bradley, Senator Dan Coats, Roger L. Conner, Ralf Dahrendorf, John J., Jr. DiIulio, William J. Doherty, Jean Bethke Elshtain, James S. Fishkin, William Galston, Mary Ann Glendon, Robert E. Goodin, Peter Katz, Mark Kleiman, Judith Martin, Dallin H. Oaks: 9780847688272: Amazon.com: Books	 Rowman & Littlefield Publishers (February 17, 1998)
081607903X	Winning the White House 2008: The Gallup Poll, Public Opinion, and the Presidency (Facts on File Library of American History): Frank Newport, Alec M. Gallup, Fred L. Israel, Lydia Saad, Jeffrey M. Jones: 9780816079032: Amazon.com: Books	 Checkmark Books (April 2009)
0470281685	Blasphemy: How the Religious Right is Hijacking the Declaration of Independence: Alan Dershowitz: 9780470281680: Amazon.com: Books	 Wiley; 1 edition (June 16, 2008)
0385525869	Know Your Power: A Message to America&#39;s Daughters: Nancy Pelosi, Amy Hill Hearth: 9780385525862: Amazon.com: Books	 Doubleday; 1 edition (July 29, 2008)
1604861975	Amazon.com: Re:Imagining Change: How to Use Story-based Strategy to Win Campaigns, Build Movements, and Change the World (9781604861976): Doyle Canning, Patrick Reinsborough: Books	 PM Press (April 1, 2010)
0700616268	Intelligence Matters: The CIA, the FBI, Saudi Arabia, and the Failure of America&#39;s War on Terror: Bob Graham, Jeff Nussbaum: 9780700616268: Amazon.com: Books	 Univ Pr of Kansas; Reprint edition (September 11, 2008)
1560259485	Fighting Words: A Toolkit for Combating the Religious Right: Robin Morgan: 9781560259480: Amazon.com: Books	 Nation Books (August 25, 2006)
1594865140	Amazon.com: Air America: The Playbook: What a Bunch of Left Wing Media Types have to Teach you about a World Gone Right: Chuck D., David Bender, Thom Hartmann, Robert F. Kennedy Jr., C. Welton Gaddy: Books	 Rodale Books (September 19, 2006)
0465013872	Change for America: A Progressive Blueprint for the 44th President: Mark Green, Michele Jolin: 9780465013876: Amazon.com: Books	 Basic Books; First Edition edition (January 6, 2009)
1608461548	The United States of Fear: Tom Engelhardt: 9781608461547: Amazon.com: Books	 Haymarket Books (December 13, 2011)
1560259566	The Hijacking of Jesus: How the Religious Right Distorts Christianity and Promotes Prejudice and Hate: Dan Wakefield: 9781560259565: Amazon.com: Books	 Nation Books (January 2, 2007)
0300126107	Does American Democracy Still Work? (The Future of American Democracy Series): Alan Wolfe: 9780300126105: Amazon.com: Books	 Yale University Press (September 28, 2007)
1904859356	Amazon.com: Constituent Imagination: Militant Investigations, Collective Theorization (9781904859352): Stevphen Shukaitis, David Graeber, Erika Biddle: Books	 AK Press (February 1, 2007)
0374530904	Thinking Points: Communicating Our American Values and Vision: George Lakoff: 9780374530907: Amazon.com: Books	 Farrar, Straus and Giroux; 1st edition (October 3, 2006)
1401324568	Listening In: The Secret White House Recordings of John F. Kennedy: Ted Widmer, Caroline Kennedy: 9781401324568: Amazon.com: Books	 Hyperion; Har/Com edition (September 25, 2012)
0804770271	Taking Local Control: Immigration Policy Activism in U.S. Cities and States: Monica Varsanyi: 9780804770279: Amazon.com: Books	 Stanford University Press (July 23, 2010)
1859844146	Homocons: The Rise of the Gay Right: Richard Goldstein: 9781859844144: Amazon.com: Books	 Verso (November 2003)
0691128332	Religion in American Politics: A Short History: Frank Lambert: 9780691128337: Amazon.com: Books	 Princeton University Press; First edition (January 28, 2008)
0393330702	What&#39;s Liberal About the Liberal Arts?: Classroom Politics and &quot;Bias&quot; in Higher Education: Michael Bérubé: 9780393330700: Amazon.com: Books	 W. W. Norton & Company (September 17, 2007)
0199283265	A Brief History of Neoliberalism: David Harvey: 9780199283262: Amazon.com: Books	 Oxford University Press, USA; First Edition edition (September 15, 2005)
1439181039	We Seven: By the Astronauts Themselves: M. Scott Carpenter, Gordon L. Cooper, John H. Glenn, Virgil I. Grissom, Walter M. Schirra, Alan B. Shepard, Donald K. Slayton: Amazon.com: Books	 Simon & Schuster (January 12, 2010)
1565849205	With God On Their Side: How Christian Fundamentalists Trampled Science, Policy, And Democracy In George W. Bush&#39;s White House: Esther Kaplan: 9781565849204: Amazon.com: Books	 New Press, The; First Printing edition (October 7, 2004)
0615600611	Winning the Inside Game: The Handbook of Advocacy Strategies: Mr. Ilir Zherka: 9780615600611: Amazon.com: Books	 Ilir Zherka (August 11, 2012)
0742527573	The Collapse of Liberalism: Why America Needs a New Left (Polemics): Charles Noble: 9780742527577: Amazon.com: Books	 Rowman & Littlefield Publishers (May 2004)
0807004111	The Unfinished War: Vietnam and the American Conscience: Walter H. Capps: 9780807004111: Amazon.com: Books	 Beacon Press; 2 edition (August 31, 1990)
184467861X	The Liberal Defence of Murder: Richard Seymour: 9781844678617: Amazon.com: Books	 Verso; 1 edition (July 4, 2012)
0061900648	The Making of the President 1968 (Landmark Political): Theodore H. White: 9780061900648: Amazon.com: Books	 Harper Perennial; Reissue edition (October 5, 2010)
0299106446	La Follette Insurgent Spirit: David P. Thelen, Oscar Handlin: 9780299106447: Amazon.com: Books	 University of Wisconsin Press (May 15, 1986)
0198290918	Multicultural Citizenship: A Liberal Theory of Minority Rights (Oxford Political Theory): Will Kymlicka: 9780198290919: Amazon.com: Books	 Oxford University Press, USA (October 17, 1996)
0684815184	SHOWDOWN: The Struggle Between the Gingrich Congress and the Clinton White House: Elizabeth Drew: 9780684815183: Amazon.com: Books	 Simon & Schuster (April 12, 1996)
0691037647	The Lincoln Persuasion: Remaking American Liberalism: J. David Greenstone: 9780691037646: Amazon.com: Books	 Princeton Univ Pr (July 25, 1994)
1859849520	Hotel America: Scenes in the Lobby of the Fin-De-Siecle: Lewis H. Lapham: Amazon.com: Books	 Verso Books (September 1995)
0395860423	The Gentleman From New York: Daniel Patrick Moynihan -- A Biography: Godfrey Hodgson: 0046442860420: Amazon.com: Books	 Houghton Mifflin Harcourt; 1St Edition edition (August 16, 2000)
006019393X	If the Gods Had Meant Us to Vote They Would Have Given Us Candidates: Jim Hightower: 9780060193935: Amazon.com: Books	 Harper; 1st edition (February 2, 2000)
0765324474	The Dream That Will Not Die: Inspiring Words of John, Robert, and Edward Kennedy: Brian M. Thomsen: Amazon.com: Books	 Forge Books; First Edition edition (April 27, 2010)
0977197298	Amazon.com: Framing the Debate: Famous Presidential Speeches and How Progressives Can Use Them to Change the Conversation (And Win Elections) (9780977197293): Jeffrey Feldman, George Lakoff: Books	 Ig Publishing; 1st Pbk. Ed edition (April 1, 2007)
0978843142	Amazon.com: Loser Take All: Election Fraud and The Subversion of Democracy, 2000 - 2008 (9780978843144): Mark Crispin Miller: Books	 Ig Publishing (April 1, 2008)
0807130605	Falling Up: How A Redneck Helped Invent Political Consulting (Politics@media): Raymond D. Strother: 9780807130605: Amazon.com: Books	 Louisiana State Univ Pr (April 2005)
1605093300	Amazon.com: 2048: Humanity&#39;s Agreement to Live Together: J. Kirk Boyd: Books	 Berrett-Koehler Publishers; 1 edition (April 12, 2010)
1609940296	Rebooting the American Dream: 11 Ways to Rebuild Our Country (Bk Currents): Thom Hartmann: Amazon.com: Books	 Berrett-Koehler Publishers; PB reissue edition (August 1, 2011)
1932528067	Neo-Conned!: Just War Principles: A Condemnation of War in Iraq: D. Liam O&#39;Huallachain, J. Forrest Sharpe, George Lopez PhD, Bishop Hilarion Capucci: 9781932528060: Amazon.com: Books	 Ihs Press (October 28, 2006)
0553456628	John Glenn: A Memoir: John Glenn, Nick Taylor: 9780553456622: Amazon.com: Books	 Random House Audio; Abridged edition (November 2, 1999)
1438432321	Conservatism and Racism, and Why in America They Are the Same (Suny Series in African American Studies): Robert Charles Smith: 9781438432328: Amazon.com: Books	 State University of New York Press (October 1, 2010)
1568587287	Amazon.com: The World As It Is: Dispatches on the Myth of Human Progress (9781568587288): Chris Hedges: Books	 Nation Books; Revised Edition edition (February 12, 2013)
0143035533	Politics: Observations and Arguments, 1966-2004: Hendrik Hertzberg: 9780143035534: Amazon.com: Books	 Penguin Books; First Edition edition (June 28, 2005)
0465046754	The Republican War on Science: Chris Mooney: 9780465046751: Amazon.com: Books	 Basic Books (August 30, 2005)
039331524X	The Godless Constitution: The Case Against Religious Correctness: Isaac Kramnick, R. Laurence Moore: 9780393315240: Amazon.com: Books	 W. W. Norton & Company (February 1997)
0312641648	The Obama Hate Machine: The Lies, Distortions, and Personal Attacks on the President---and Who Is Behind Them: Bill Press: 9780312641641: Amazon.com: Books	 Thomas Dunne Books (January 31, 2012)
038552062X	Amazon.com: The Great Derangement: A Terrifying True Story of War, Politics, and Religion (9780385520621): Matt Taibbi: Books	 Spiegel & Grau; Reprint edition (January 13, 2009)
0465083277	Radicals in Robes: Cass R. Sunstein: Amazon.com: Books	 Basic Books (December 4, 2006)
0807128562	Falling Up: How a Redneck Helped Invent Political Consulting (Politics Media): Raymond D. Strother: 9780807128565: Amazon.com: Books	 Louisiana State Univ Pr; First Edition edition (February 2003)
0679723153	The American Political Tradition: And the Men Who Made it: Richard Hofstadter: 9780679723158: Amazon.com: Books	 Vintage; First THUS Edition edition (April 23, 1989)
0979482267	Amazon.com: Why I&#39;m a Democrat (9780979482267): Susan Mulcahy, David Brock: Books	 PoliPointPress (July 4, 2008)
1587610957	Positively Gay: New Approaches to Gay and Lesbian Life: Betty Berzon, Barney Frank: 9781587610950: Amazon.com: Books	 Celestial Arts; 3 edition (August 21, 2001)
0801484510	Radical Democracy: C. Douglas Lummis: 9780801484513: Amazon.com: Books	 Cornell University Press (July 2, 1997)
0470372303	Amazon.com: Now or Never: Getting Down to the Business of Saving Our American Dream: Jack Cafferty: Books	 Wiley (March 9, 2009)
938104306X	Amazon.com: Human Rights: Voices of World&#39;s Young Activists (Critical Debates on Frontpage) (9789381043066): Amii Omara-Otunnu, Amil Omara-Otunnu, Sergio Mobilia, Bandana Purkayastha: Books	 frontpage (June 1, 2012)
0375413383	Political Fictions: Joan Didion: 9780375413384: Amazon.com: Books	 Knopf; 1 edition (September 11, 2001)
0977795365	Overthrow a Fascist Regime on $15 a Day: Wayne Madsen: 9780977795369: Amazon.com: Books	 Trine Day; 1 edition (January 21, 2008)
031600023X	Amazon.com: Worse Than Watergate: The Secret Presidency of George W. Bush (9780316000239): John W. Dean: Books	 Little, Brown and Company; 1 edition (April 6, 2004)
0806139447	Amazon.com: A Letter to America (9780806139449): David L. Boren: Books	 Univ of Oklahoma Pr (Trd); First Printing edition (February 28, 2008)
0743228421	My Declaration of Independence: James M. Jeffords: 9780743228428: Amazon.com: Books	 Simon & Schuster; 1st edition (November 15, 2001)
0312561652	Amazon.com: Letter to a New President: Commonsense Lessons for Our Next Leader: Robert C. Byrd Sen., Steve Kettmann: Books	 St. Martin's Griffin; First Edition edition (January 6, 2009)
1597776467	The Governor: Rod Blagojevich: Amazon.com: Books	 Phoenix Books; First Edition edition (September 8, 2009)
0521150175	Human Rights, State Compliance, and Social Change: Assessing National Human Rights Institutions (English and English Edition): Ryan Goodman, Thomas Pegram: 9780521150170: Amazon.com: Books	 Cambridge University Press (November 14, 2011)
1611681863	Amazon.com: An Uncommon Man: The Life and Times of Senator Claiborne Pell (9781611681864): G. Wayne Miller: Books	 UPNE (October 11, 2011)
1416574689	Amazon.com: The Conservative Assault on the Constitution: Erwin Chemerinsky: Books	 Simon & Schuster (September 28, 2010)
140006676X	Amazon.com: Truth and Consequences: Special Comments on the Bush Administration&#39;s War on American Values (9781400066766): Keith Olbermann: Books	 Random House; 1 edition (December 26, 2007)
0700616721	Getting the Left Right: The Transformation, Decline, and Reformation of American Liberalism: Thomas A. Spragens Jr.: 9780700616725: Amazon.com: Books	 University Press of Kansas (September 1, 2009)
0812242157	Universal Human Rights and Extraterritorial Obligations (Pennsylvania Studies in Human Rights): Mark Gibney, Sigrun Skogly: 9780812242157: Amazon.com: Books	 University of Pennsylvania Press (January 26, 2010)
1593376197	Jesus Rode A Donkey: Why Republicans Don&#39;t Have the Corner on Christ: Linda Seger: Amazon.com: Books	 Adams Media (July 24, 2006)
0813125960	Amazon.com: The Dilemmas of American Conservatism (9780813125961): Kenneth L. Deutsch, Ethan Fishman: Books	 The University Press of Kentucky; 1St Edition edition (August 18, 2010)
074328075X	The Fall of the House of Bush: The Untold Story of How a Band of True Believers Seized the Executive Branch, Started the Iraq War, and Still Imperils America&#39;s Future: Craig Unger: 9780743280754: Amazon.com: Books	 Scribner; 1 edition (November 13, 2007)
1590201833	Amazon.com: Reporting America: Alistair Cooke: Books	 Overlook Hardcover (November 26, 2008)
0975574906	Amazon.com: We Stand Passively Mute (9780975574904): Robert C. Byrd: Books	 Papyngay Press (July 2004)
1565848918	Amazon.com: Spanking the Donkey: Dispatches from the Dumb Season (9781565848917): Matt Taibbi: Books	 New Press, The (April 29, 2005)
0801879671	Daniel Patrick Moynihan: The Intellectual in Public Life: Robert A. Katzmann: 9780801879678: Amazon.com: Books	 The Johns Hopkins University Press; 2 edition (March 17, 2004)
1594868077	Madam Speaker: Nancy Pelosi&#39;s Life, Times, and Rise to Power: Marc Sandalow: Amazon.com: Books	 Modern Times; First Edition edition (April 29, 2008)
0140088199	With All Disrespect: Calvin Trillin: 9780140088199: Amazon.com: Books	 Penguin Books (July 1, 1986)
082720034X	A New Evangelical Manifesto: A Kingdom Vision for the Common Good: David P. Gushee: 9780827200340: Amazon.com: Books	 Chalice Press (August 30, 2012)
1932595422	The 35 Articles of Impeachment and the Case for Prosecuting George W. Bush: Dennis Kucinich, David Swanson, Elizabeth de la Vega: 9781932595420: Amazon.com: Books	 Feral House; annotated edition edition (November 1, 2008)
1441126937	Answering Back: Liberal Responses to Conservative Arguments: David Coates: 9781441126931: Amazon.com: Books	 Continuum; 1 edition (December 31, 2009)
0307236897	The Republican Noise Machine: Right-Wing Media and How It Corrupts Democracy: David Brock: 9780307236890: Amazon.com: Books	 Three Rivers Press; Reprint edition (April 12, 2005)
0307386252	Amazon.com: The Future of Liberalism (9780307386250): Alan Wolfe: Books	 Vintage (February 9, 2010)
0553382926	The War on Choice: The Right-Wing Attack on Women&#39;s Rights and How to Fight Back: Gloria Feldt: 9780553382921: Amazon.com: Books	 Bantam (April 13, 2004)
0679753141	The End Of Reform: New Deal Liberalism in Recession and War: Alan Brinkley: 9780679753148: Amazon.com: Books	 Vintage (January 30, 1996)
1844677575	The Obama Syndrome: Surrender at Home, War Abroad: Tariq Ali: 9781844677573: Amazon.com: Books	 Verso; Updated edition (September 1, 2011)
0547085702	The Big Con: Crackpot Economics and the Fleecing of America: Jonathan Chait: Amazon.com: Books	 Mariner Books; Reprint edition (September 3, 2008)
0231126093	Reclaiming the Enlightenment: Toward a Politics of Radical Engagement: Stephen Eric Bronner: 9780231126090: Amazon.com: Books	 Columbia University Press (May 16, 2006)
0679754881	Nothin&#39; But Good Times Ahead: Molly Ivins: 9780679754886: Amazon.com: Books	 Vintage; 1st Vintage Books Ed edition (September 27, 1994)
0679451528	This Noble Land: My Vision for America: James A. Michener: 9780679451525: Amazon.com: Books	 Random House; 1 edition (October 8, 1996)
0814799841	The Left at War (Cultural Front): Michael F. Bérubé: 9780814799840: Amazon.com: Books	 NYU Press (November 16, 2009)
0394488806	American Political Tradition: Richard Hofstadter: 9780394488806: Amazon.com: Books	 Knopf; 2 Revised edition (November 12, 1973)
1859844669	Deepening Democracy: Institutional Innovations in Empowered Participatory Governance (The Real Utopias Project) (v. 4): Archon Fung, Erik Olin Wright, Rebecca Neaera Abers, Gianpaolo Baiocchi, Joshua Cohen, Patrick Heller, T. M. Thomas Isaac, Bradley C. Karkkainen, Rebecca S. Krantz, Jane Mansbridge, Joel Rogers, Craig W. Thomas: 9781859844663: Amazon.com: Books	 Verso (March 2003)
0471789607	Being Right Is Not Enough: What Progressives Must Learn from Conservative Success: Paul Waldman: 9780471789604: Amazon.com: Books	 Wiley; 1 edition (April 28, 2006)
0374278369	Tocqueville: A Biography: Andre Jardin: 9780374278366: Amazon.com: Books	 Farrar, Straus and Giroux; 1st U.S. Ed edition (November 1, 1988)
140015457X	American Fascists: The Christian Right and the War on America: Chris Hedges, Eunice Wong: Amazon.com: Books	 Tantor Media; Unabridged,MP3 - Unabridged CD edition (June 15, 2007)
1441186506	Amazon.com: Making the Progressive Case: Towards a Stronger U.S. Economy (9781441186508): David Coates: Books	 Continuum; 1 edition (June 16, 2011)
0449013677	The Oath: The Obama White House and the Supreme Court: Jeffrey Toobin, Robertson Dean: 9780449013670: Amazon.com: Books	 Random House Audio; Unabridged edition (September 18, 2012)
158826470X	Republicans and the Black Vote: Michael K. Fauntroy: 9781588264701: Amazon.com: Books	 Lynne Rienner Pub (December 15, 2006)
1461054281	A Letter to US Middle-Class Christians: Daniel Burgin: 9781461054283: Amazon.com: Books	 CreateSpace Independent Publishing Platform (March 31, 2011)
0060842474	The Left Hand of God: Taking Back Our Country from the Religious Right: Michael Lerner: 9780060842475: Amazon.com: Books	 HarperOne (February 7, 2006)
1416596283	Amazon.com: 40 More Years: How the Democrats Will Rule the Next Generation (9781416596288): James Carville, Rebecca Buckwalter-Poza: Books	 Simon & Schuster (February 5, 2011)
0684831864	Up from Conservatism: Michael Lind: 9780684831862: Amazon.com: Books	 Free Press (July 15, 1997)
1591024633	The Angry Right: Why Conservatives Keep Getting It Wrong: S. T. Joshi, Robert Glisson: 9781591024637: Amazon.com: Books	 Prometheus Books (September 5, 2006)
1400065763	Vice: Dick Cheney and the Hijacking of the American Presidency: Lou Dubose, Jake Bernstein: 9781400065769: Amazon.com: Books	 Random House; First Edition edition (October 17, 2006)
0385516053	How the Republicans Stole Christmas: The Republican Party&#39;s Declared Monopoly on Religion and What Democrats Can Do to Take It Back: Bill Press: 9780385516051: Amazon.com: Books	 Doubleday Religion (October 11, 2005)
